<!--
################################################################################
#
# Copyright 2011 Carlos Ramisch, Vitor de Araujo
#
# mwetoolkit-corpus.dtd is part of mwetoolkit
#
# mwetoolkit is free software: you can redistribute it and/or modify
# it under the terms of the GNU General Public License as published by
# the Free Software Foundation, either version 3 of the License, or
# (at your option) any later version.
#
# mwetoolkit is distributed in the hope that it will be useful,
# but WITHOUT ANY WARRANTY; without even the implied warranty of
# MERCHANTABILITY or FITNESS FOR A PARTICULAR PURPOSE.  See the
# GNU General Public License for more details.
#
# You should have received a copy of the GNU General Public License
# along with mwetoolkit.  If not, see <http://www.gnu.org/licenses/>.
#
################################################################################
-->
<!ELEMENT corpus (s)*>
<!ELEMENT s (w)*>
<!ATTLIST s
    s_id CDATA #IMPLIED
>
<!ELEMENT w EMPTY>
<!ATTLIST w
    surface CDATA #REQUIRED
    lemma CDATA #IMPLIED
    pos CDATA #IMPLIED
    syn CDATA #IMPLIED 
    dep CDATA #IMPLIED     
> 
<!-- surface: Surface form of a word, like each word in the sentence "He went to the streets"
     lemma: Lemmatised (original) form of a word, like each lemma in the sentence "he go to the street"
     pos: Morphosyntactic category of a word, like each class name (N-Noun, V-Verb, etc.) in the sentence "PP V P DT N"
     == The following two attributes may be empty "" or have multiple values, in which case they will be separated by ";"
     syn: Syntax information in any formalism you like, for instance the dependency relation in the sentence "subj - - det to_pcomp"
     dep: Index of the word in the sentence on which this word depends with the "syn" relation, like in "2 - - 5 3". The index starts at 1.
-->
